직무명,직무개요,수행직무,정규교육,숙련기간,직무기능,작업강도,육체활동,작업장소,작업환경,유사명칭,관련직업,자격/면허,고용직업분류,표준직업분류,표준산업분류,조사연도,비고
무인기계경비원,"고객의 매장이나 집, 공장 등에 설치된 자산 센서, 제어 장치 등을 유지·관리하기 위해 순찰하고, 센서에 외부침입자가 감지되면 출동하여 점검한다.","고객의 매장이나 집, 공장 등의 자산 센서 및 제어 장치 등을 유지·관리한다. 설치기기에 대한 특징과 사용법을 고객에게 설명한다. 현장을 정기적으로 순찰하고, 보안장치를 점검하여 이상 유무를 기록한다. 센서에 외부침입자가 감지되어 회사의 관제실로 보고되면, 관제실의 지령을 받아 출동하여 보안상황을 점검한다. 도난사실 여부에 따라 고객에게 통보하거나 상황에 따라 경찰지원을 요청한다. 사용 장비 및 기기를 점검하고, 출동차량을 정리한다.",9년 초과 ~ 12년 이하(고졸 정도),3개월 초과 ~ 6개월 이하,자료 (비교) / 사람 (말하기-신호) / 사물 (단순작업),가벼운 작업,-,실외,위험내재,무인경비원,-,기계경비지도사,[5413]시설·특수 경비원,[4123]시설 및 특수 경비원,"[N753]경비, 경호 및 탐정업",2017,-
무인변전소관리원,"일정 주기로 순회하면서 무인변전설비를 점검하고, 고장 발생 시 급전 지휘계통의 지시에 따라 이를 조정·제어한다.","전격전압, 주파수, 전력량 등을 조정하여 정전이 되지 않도록 무인변전소의 변전설비를 제어한다. 변전소 각종 설비의 작동이 정상적으로 이루어지는지 작동상태 모니터를 감시한다. 외부 무단출입자로부터 무인변전소의 각종 설비를 보호하기 위하여 원격감시장치를 주시한다. 관할 지역 변전소의 변동사항을 감시하여 문제 발생 시 대처한다.",14년 초과 ~ 16년 이하(대졸 정도),2년 초과 ~ 4년 이하,자료 (수집) / 사람 (말하기-신호) / 사물 (제어조작),보통 작업,-,실내,위험내재,-,-,"전기기사, 전기공사기사",[8330]발전·배전 장치 조작원,[8610]발전 및 배전장치 조작원,[D351]전기업,2014,-
무인항공촬영기사,"촬영기술을 기초로 소형카메라가 장착된 헬기(헬리캠, 플라이캠 등)를 조종하여 각종 물체나 대상을 촬영한다.","촬영감독과 협의하여 촬영 대본(시나리오)에 따라 장면배열을 결정하고, 촬영장비 선정 등 촬영계획을 세운다. 지방항공청, 국방부에 촬영승인을 요청하여 촬영허가를 받는다. 헬리캠 배터리 점검, 장비의 작동 점검 등을 한다. 촬영현장을 답사하여 촬영에 영향을 줄 수 있는 요인을 분석하고, 촬영에 필요한 제반 사항을 결정한다. 헬리캠을 조종하는 촬영기사와 협의하여 카메라 조종용 리모콘을 작동한다. 촬영대상, 촬영거리, 화면사이즈 등을 고려하여 촬영하며, 모니터를 통해 확인한다. 촬영한 영상은 현장에 점검 나온 관리기관 담당자에게 바로 보안검사를 받고, 문제 시 되는 부분은 삭제하여 검사를 완료한 후 납품한다. 파손된 촬영장비, 드론 등을 직접 수리하기도 한다.",12년 초과 ~ 14년 이하(전문대졸 정도),2년 초과 ~ 4년 이하,자료 (비교) / 사람 (말하기-신호) / 사물 (제어조작),보통 작업,"손사용
시각",실외,-,"플라이캠촬영기사, 드론촬영기사, 헬리캠촬영기사","무인항공기조종사, 방송촬영감독, 영화촬영감독",초경량비행장치 조종사,[4164]촬영 기사,[2834]촬영기사,"[J591]영화, 비디오물, 방송프로그램 제작 및 배급업 / [J602]텔레비전 방송업",2015,-
무전기기술자,전기·전자기기에 관한 지식을 활용하여 민간용·산업용 무전기기를 설계·제작한다.,"제품생산에 대한 정보를 입수하고 확인한다. 새로운 모델을 제작하기 위한 부품의 종류 및 사양, 제품명세서 등을 작성하고, 회로도를 작성한다. 제작된 견본의 전기적·기구적 문제점을 점검하고 특성을 시험하고 문제점을 해결한다. 대량생산을 위한 작업공정도, 작업지도서 등을 작성하고 고정구를 제작한다. 계측기기를 공정에 따라 재조정한다. 생산 시 문제점을 파악하고 조치한다.",14년 초과 ~ 16년 이하(대졸 정도),4년 초과 ~ 10년 이하,자료 (종합) / 사람 (말하기-신호) / 사물 (정밀작업),가벼운 작업,-,실내,위험내재,-,-,"무선설비기사, 무선설비산업기사, 무선설비기능사, 전자기사, 전파전자기사, 전파전자산업기사",[1312]통신공학 기술자 및 연구원,[2212]통신공학 기술자 및 연구원,[C264]통신 및 방송 장비 제조업,2014,-
무전기조립원,각종 전자부품이 조립된 인쇄회로기판을 일정 모양으로 사출·성형된 케이스에 조립한다.,회로기판과 전자부품으로 결선·납땜·조립된 부품에 절연재베이스를 부착시킨다. 작업지시서에 따라 인쇄회로기판과 기타 부품들을 성형된 케이스(무전기 몸통)에 삽입하고 드라이버를 사용하여 나사로 조인다. 각종 계측기기를 사용하여 성능검사를 작업지시서에 따라 수행한다.,6년 초과 ~ 9년 이하(중졸 정도),6개월 초과 ~ 1년 이하,자료 (비교) / 사람 (관련없음) / 사물 (수동조작),보통 작업,-,실내,-,-,-,-,[8360]전기·전자 부품·제품 조립원,[8640]전기·전자 부품 및 제품 조립원,[C264]통신 및 방송 장비 제조업,2014,-
무전해도금원,외부로부터 전기에너지를 공급받지 않고 금속염 수용액 중의 금속이온을 환원제의 힘에 의해 자기 촉매적으로 환원시켜 피처리물의 표면 위에 금속을 석출시킨다.,"작업표준서를 보고 작업에 필요한 장비와 공구를 준비한다. 밀착을 좋게 하기 위하여 성형응력을 제거하고, 친수성을 가지게 한다. 다음 공정의 에칭을 균일하게 하기 위하여 표면조정 및 탈지액을 건욕하고 탈지를 실시한다. 작업표준서 대로 에칭(Etching)액을 건욕하고 에칭을 한다. 감수성처리(Sensitizing)액을 건욕하고 부식에 의해 조화된 표면에 환원력이 강한 주석이온을 흡착시킨다. 활성화처리(Activation)액을 건욕하고 무전해 도금에서 촉매가 될 금속 팔라듐을 석출시킨다. 캐털리스팅에서 흡착된 염화제일주석과 염화팔라듐 콜로이드 촉매 중 염화제일주석을 제거하기 위하여 액셀러레이션 처리를 한다. 화학니켈도금액 또는 화학구리도금액을 건욕하고 화학도금을 한다. 전기를 통하여 황산구리도금을 실시한다.",9년 초과 ~ 12년 이하(고졸 정도),1년 초과 ~ 2년 이하,자료 (수집) / 사람 (관련없음) / 사물 (수동조작),보통 작업,손사용,실내,"대기환경미흡
위험내재
고온
다습",-,-,"표면처리기능장, 표면처리산업기사, 표면처리기능사",[8252]도금·금속분무기 조작원,[8422]도금 및 금속 분무기 조작원,[C259]기타 금속 가공제품 제조업,2019,-
무형재산권관리원,"소설, 논문, 음악, 연극, 미술, 건축설계도서, 사진, 영상, 지도, 컴퓨터프로그램 등에 관한 저작권 및 특허권, 상표권 등의 무형재산권을 무형재산권자로부터 위탁받아 관리하고, 이를 제3의 이용자에게 중개, 계약체결, 임대료 징수 등의 업무를 수행한다.","소설, 논문, 음악, 연극, 미술, 건축설계도서, 사진, 영상, 지도, 컴퓨터프로그램 등에 관한 저작권 및 특허권, 상표권 등의 무형재산권을 무형재산권자로부터 신탁 의뢰를 받아 신탁계약을 체결한다. 위탁받은 무형재산권의 리스트를 정리하고, 기존의 합법적 이용 현황을 조사한다. 무형재산권 이용희망자로부터 이용신청을 받으면, 이용허락 계약을 체결하고, 이용료를 징수한다. 이용자가 계약에 명시된 이용 분야, 이용 기간, 이용 분량, 이용 형태대로 이용하고 있는지를 조사확인한다. 위탁받은 무형재산권에 대한 불법이용 실태를 조사하거나 신고를 접수받아 불법이용자에게 손해배상을 청구한다. 합법적 이용자의 이용료와 불법이용에 따른 손해배상금을 무형재산권자에게 지급한다. 그 밖에 합법적 무형재산권 이용에 관한 홍보를 하고, 무형재산권에 관한 법률상담을 한다.",14년 초과 ~ 16년 이하(대졸 정도),1년 초과 ~ 2년 이하,자료 (수집) / 사람 (협의) / 사물 (관련없음),아주 가벼운 작업,-,실내,-,무형재산권위탁관리자,"지적재산권임대관리자, 저작권위탁관리자",소프트웨어자산관리사(C-SAM),[2220]법률 사무원,[3301]법률 관련 사무원,[K649]기타 금융업,2013,-
문서감정사,"문서 작성에 사용된 문자, 기호, 인영, 잉크 등을 분석하여 그 문서의 위조, 변조, 작성시기 등을 식별한다.","문서감정 요청 분야, 감정 완료일자 등을 의뢰인과 협의한다. 요청된 분야의 감정을 위해 관련 자료를 수집하고 분석한다. 입체현미경, 자외선 감식기, 적외선 현미경, 문서감식기 및 화학약품 등을 사용하여 문서 작성에 사용된 문자, 기호, 인영(도장을 찍은 형적), 잉크의 크기, 모양, 두께, 연결상태 등을 파악한다. 워드문서의 폰트의 동일성 여부파악 및 잠재지문의 현출작업을 수행한다. 진본과 비교하거나 역사적 사실, 물리적 특성, 개인적 특성 등을 토대로 진위여부, 작성연도 등을 파악한다. 감정 목적, 방법, 결과 등을 담은 감정결과서를 작성한다.",14년 초과 ~ 16년 이하(대졸 정도),4년 초과 ~ 10년 이하,자료 (분석) / 사람 (말하기-신호) / 사물 (정밀작업),가벼운 작업,"손사용
시각",실내,-,,,,[0234]감정 전문가,[2741]감정 관련 전문가,"[M739]그 외 기타 전문, 과학 및 기술 서비스업",2021,-
문양지펀칭기조작원,카펫에 무늬를 내는 데 사용되는 문지(패턴카드)를 제작하기 위해 컴퓨터 및 펀칭기계를 조작한다.,펀칭이 안 된 문지(패턴카드)를 펀칭기에 끼운다. 컴퓨터프로그램을 사용하여 생산할 카펫무늬대로 문지를 펀칭하도록 펀칭기를 작동한다. 펀칭되어 나오는 여러 장의 문지를 문지연결기(Card Lacing Machine)에 순서대로 넣어 연결한다. 프로그램을 조작하여 새로운 무늬를 만들기도 한다.,9년 초과 ~ 12년 이하(고졸 정도),6개월 초과 ~ 1년 이하,자료 (수집) / 사람 (관련없음) / 사물 (제어조작),보통 작업,-,실내,-,펀칭원,-,-,[8649]기타 직물·신발 기계 조작원 및 조립원,[8229]기타 직물·신발 관련 기계 조작원 및 조립원,[C139]기타 섬유제품 제조업,2016,-
문자판실크인쇄원,명세서에 명시된 모양을 내기 위해 인쇄장비를 사용하여 시계의 문자판 표면에 실크인쇄를 한다.,"작업명세서와 도면을 보고 실크인쇄 할 문자판의 규격, 형태, 두께 등을 확인한다. 실크인쇄기, 인쇄망, 전사필름, 잉크 적외선 건조기 등의 원료 및 장비의 작동 여부를 점검한다. 인쇄 모양대로 현상액을 칠하여 건조한 후, 인쇄되지 않을 부분의 실크인쇄망에 필름을 부착하고 세척액으로 씻은 후 스크린망을 완료한다. 스크린망과 지그잉크를 준비한다. 기계에 지그를 고정한 후 스크린망을 조립한다. 잉크를 넣고 지그에 문자판을 고정한다. 잉크의 농도를 맞춘 후 찍어서 투영기로 초점을 맞춘다. 실크인쇄 전 문자판 상면과 필름부위의 오염물질을 제거한 후 스크린망으로 문자판에 실크인쇄를 한다. 인쇄를 한 후 실크망을 들어내고 문자판을 적외선 건조기에 넣고 건조시킨다. 제품의 규격 및 크기에 따라 실크망을 제작하고 파손된 실크망을 수리·보수하기도 한다.",9년 초과 ~ 12년 이하(고졸 정도),1년 초과 ~ 2년 이하,자료 (비교) / 사람 (말하기-신호) / 사물 (조작운전),보통 작업,-,실내,"대기환경미흡
소음·진동",-,-,"인쇄기능사, 인쇄산업기사",[8811]인쇄기계 조작원,[8921]인쇄기 조작원,[C274]시계 및 시계부품 제조업,2017,-
문자판전사원,"인쇄장비를 사용하여 시계의 시자(時字), 분 및 초궤도, 회사명을 시계문자판에 새긴다.","작업지시서에 따라 전사할 문자판의 규격, 형태, 수량을 확인한다. 전자인쇄기, 잉크, 주걱, 문자판 등의 원료 및 장비를 점검한다. 도안 및 문양을 확인하고 고정구를 전자인쇄기의 젤라틴 상단에 놓는다. 양각된 금속판을 고정구에 놓고 잉크를 판 위에 칠한다. 주걱을 사용하여 남은 잉크를 제거한다. 전자인쇄기의 젤라틴(Gelatin) 상단을 판에 내려 도안을 복사한다. 도안을 문자판에 찍기 위해 문자판을 제 위치에 놓고 젤라틴 상단을 내린다. 패드를 이용하여 찍어서 패드인쇄를 하기도 한다. 부품을 보호하기 위해 문자판의 일정 부위에 래커(Lacquer) 칠을 한다.",9년 초과 ~ 12년 이하(고졸 정도),6개월 초과 ~ 1년 이하,자료 (비교) / 사람 (말하기-신호) / 사물 (수동조작),아주 가벼운 작업,-,실내,소음·진동,-,-,"인쇄기능사, 인쇄산업기사",[8811]인쇄기계 조작원,[8921]인쇄기 조작원,[C274]시계 및 시계부품 제조업,2017,-
문자판제조반장,"시계문자판 제조공정에 관여하는 타발(打拔), 시자(時字, Index), 삽입, 용접, 광택, 도금, 인쇄, 도장하는 작업원의 활동을 감독·조정한다.","문자판 제조공정, 문자판 부품 및 문자판기능 등의 문자판 전반에 관한 지식과 내용을 숙지한다. 생산량, 시간계획 등을 수립하여 문자판제조 계획에 따라 작업원을 적정하게 배치한다. 생산계획에 따른 작업계획을 수립하고 부품을 불출한다. 각 제조공정을 관리·감독하며 때에 따라서는 기술지도도 병행한다. 사양서 및 도면을 보고 공정표, 시방서를 만들어 작업계획을 세운다. 제품수량 및 품질을 점검하고 공정진행전표를 확인·점검·기록한다. 문자판기준도를 참조하여 검사표를 작성하여 각 수행하는 직무에 관하여 감독한다. 수행하는 직무에 관하여 훈련을 시키고 공급품 및 재료를 청구한다. 부서 상호 간 원활한 작업흐름을 위해 각 작업반장들과 협의한다. 작업원들과의 협의를 통해 고충문제를 처리하며 각 기계 및 기계장치를 설치·관리한다.",9년 초과 ~ 12년 이하(고졸 정도),4년 초과 ~ 10년 이하,자료 (조정) / 사람 (감독) / 사물 (관련없음),보통 작업,-,실내,-,-,"문자판식자반장, 문자판프레스반장, 문자판도금반장, 문자판조립반장",-,[8360]전기·전자 부품·제품 조립원,[8640]전기·전자 부품 및 제품 조립원,[C274]시계 및 시계부품 제조업,2014,-
문자판조립원,"연마기, 용접기, 프레스 등을 이용하여 타공·용접·부착·광택·연마작업을 하여 시계의 문자판을 제조한다.","작업지시서와 명세서에 따라 제조할 문자판을 확인하고 작업 전 도면을 파악한다. 작업을 하기 위해 연마기, 용접기, 프레스, 접착제, 도금기 등의 장비와 공구를 준비하고 작동 여부를 확인한다. 수동공구 및 프레스를 사용하여 문자판 재료를 자른 후 족부기 및 용접기구로 문자판에 지지다리를 부착한다. 연마기를 사용하여 문자판에 광택을 내고 금, 은, 니켈 등을 문자판에 도금한다. 도금된 문자판에 숫자 또는 숫자표시를 접착제를 사용하여 부착한다. 문자판에 무늬·숫자·회사명을 인쇄하기도 한다. 문자판의 오염, 긁힌 자국, 인쇄된 무늬의 상태 및 치수 등이 명세서와 일치하는가를 확인한다.",9년 초과 ~ 12년 이하(고졸 정도),6개월 초과 ~ 1년 이하,자료 (비교) / 사람 (관련없음) / 사물 (수동조작),가벼운 작업,-,실내,-,-,-,-,[8360]전기·전자 부품·제품 조립원,[8640]전기·전자 부품 및 제품 조립원,[C274]시계 및 시계부품 제조업,2014,-
문자판타공원,"시자(時字, Index) 및 시침, 분침을 심기 위하여 탁상프레스 또는 밀링프레스를 조작하여 문자판에 구멍을 뚫는 작업을 한다.","작업명세서에 따라 시자(時字, Index) 및 시침, 분침을 심기 위하여 타공할 문자판의 규격, 수량 등을 파악하고 탁상프레스 또는 밀링프레스(Milling Press) 등 장비의 윤활장치, 연료 등을 점검한다. 탁상프레스에 금형을 고정시킨 후 핀셋을 이용하여 문자판을 금형에 넣는다. 밀링프레스를 조작하여 문자판에 구멍을 뚫는다. 인덱스를 심기 위한 공명 위치 거리를 확대경 및 측정기를 이용하여 수시로 확인하고 작업 부위의 매끈함 여부를 확인한다. 제품에 따라 금형을 교체하기도 한다. 기계를 점검하거나 주유작업 등의 작업을 하여 기계장비를 유지보수한다.",9년 초과 ~ 12년 이하(고졸 정도),6개월 초과 ~ 1년 이하,자료 (비교) / 사람 (관련없음) / 사물 (수동조작),가벼운 작업,-,실내,-,"문자판공명원, 타공기조작원",-,-,[8360]전기·전자 부품·제품 조립원,[8640]전기·전자 부품 및 제품 조립원,[C274]시계 및 시계부품 제조업,2014,-
문전원,어망을 제조하기 위해 북실(밑실)을 감는 기계를 조작한다.,실패를 크릴(Creel)에 꽂는다. 빈 북을 고정하고 보빈에서 실 끝을 찾아 안내대를 통과시켜 빈 북에 실이 감기는 것을 확인하여 끊어진 실을 잇는다. 북에 실이 가득차면 기계를 정지하고 칼이나 가위로 실을 잘라 전기인두를 사용하여 실 끝이 풀어지지 않게 마무리한다. 실이 감긴 북을 기계로부터 떼어내고 운반수레에 담는다.,9년 초과 ~ 12년 이하(고졸 정도),3개월 초과 ~ 6개월 이하,자료 (수집) / 사람 (관련없음) / 사물 (제어조작),가벼운 작업,-,실내,"위험내재
소음·진동",-,-,-,[8612]직조기·편직기 조작원,[8221]직조기 및 편직기 조작원,[C139]기타 섬유제품 제조업,2016,-
문지원,무늬도면에 따라 자카드 직조기계의 패턴카드에 구멍을 뚫는 기계를 조작한다.,기계 전면의 작업대에 무늬도면을 펼쳐 고정하고 천공기 아래 가이드에 재료가 되는 패턴카드를 놓는다. 디자인의 첫 번째 표시 선에 자동표시기를 맞춘다. 천공기를 시동하기 위해 클러치를 맞물린다. 무늬도면에 나타난 구멍의 배열에 따라 절단금형을 조절하는 키를 누른다. 구멍이 뚫어진 카드와 패턴을 비교하여 절단상 결함이 있는지 살펴보고 잘못 뚫어진 구멍 위에는 네모난 종이를 붙인다. 천공된 문지를 번호별로 구분·정리한다.,9년 초과 ~ 12년 이하(고졸 정도),6개월 초과 ~ 1년 이하,자료 (수집) / 사람 (관련없음) / 사물 (제어조작),보통 작업,웅크림,실내,위험내재,"문지천공원, 문지펀칭원, 패턴카드제작원",-,-,[8612]직조기·편직기 조작원,[8221]직조기 및 편직기 조작원,[C132]직물직조 및 직물제품 제조업 / [C133]편조원단 제조업,2016,-
문지제작반장,무늬 직조작업을 조절하는 데 사용되는 패턴카드를 절단하여 엮어 짜고 복사하는 일에 종사하는 작업원의 활동을 감독·조정한다.,"생산계획에 맞는 패턴체인(Pattern Chain)의 수효를 결정하기 위해 고객의 주문서와 직물 조직도를 분석한다. 분석된 자료 및 생산량 등에 의해 생산계획을 수립하고 작업내용을 작업원에게 지시한다. 작업도구의 이상 유무를 확인하고 안전교육을 실시한다. 패턴체인을 자르고 엮어 짜기 위해 작업원을 지도한다. 작업원에게 절단, 복사 등 기계조작에 관한 훈련을 한다.",9년 초과 ~ 12년 이하(고졸 정도),4년 초과 ~ 10년 이하,자료 (조정) / 사람 (감독) / 사물 (제어조작),보통 작업,-,실내,위험내재,-,-,-,[8612]직조기·편직기 조작원,[8221]직조기 및 편직기 조작원,[C133]편조원단 제조업,2016,-
문학연구원,"사상이나 감정을 언어로 표현한 예술 및 예술작품(시, 소설, 희곡, 수필, 평론)을 연구한다.","문학이론, 문학사, 문예창작, 작가론, 비교문학, 운문, 산문, 소설, 평론, 희곡, 구비문학, 아동문학, 영상문학, 번역문학, 문학교육 등 다양한 문학연구 분야에 대해 연구한다. 전문연구분야에 따라 국문학(국문학사, 고전산문, 고전시가, 고전비평, 구비문학, 현대소설, 현대시, 현대희곡, 비교문학, 문학비평, 문화론, 작문 등), 한문학(한시, 한문산문, 한문소설, 한문비평, 한국경학, 한자학·어학, 한국서예학, 한문교육 등), 중문학(중국산문, 중국시, 중국희곡, 중국고전문학, 중국소설, 사곡, 중국현대문학, 문학비평, 비교문학, 경학, 중국문화, 중국서지학, 중국서예학 등), 일본문학(일본극문학, 일본문학비평, 일본비교문학, 일본고전산문, 일본고전운문, 일본근현대산문문학, 일본근현대시가문학, 일본문화 등), 영문학(현대영미시, 현대영미소설, 현대영미희곡, 영미문학비평, 비교영문학, 중세영문학, 셰익스피어, 르네상스영문학, 17·18·19세기 영문학 등), 프랑스문학(프랑스소설, 프랑스희곡, 프랑스문학비평, 프랑스비교문학 등), 독일문학(독일소설, 독일희곡, 독일 시, 독일문예학, 독일문학사, 독일문학비평, 독일비교문학, 독일구비문학 등), 스페인문학(스페인중남미 시, 스페인중남미 소설, 스페인중남미 희곡, 스페인중남미 문학비평, 스페인중남미 비교문학 등), 러시아문학(러시아 시, 러시아 소설, 러시아 희곡, 러시아 평론, 러시아문학사, 러시아비교문학, 러시아문학이론 등), 동서양 고전문학(그리스고전문학, 라틴고전문학, 고대인도문학 등), 기타 동서양문학(북한문학, 인도문학, 아랍문학, 태국문학, 베트남문학, 몽골문학, 이탈리아문학, 폴란드문학, 루마니아문학, 체코문학, 유고문학, 헝가리문학, 네덜란드문학, 스웨덴문학, 아프리카문학 등) 분야에 대한 연구를 수행한다. 연구논문집 발간, 학술서적 발행, 연구발표회, 강연회, 학술대회 등을 통해 연구성과를 발표한다. 다른 인문학 분야와 학제 간 연계 연구를 수행하기도 한다. 그 외에 연구원(일반)이 수행하는 일반적인 업무를 수행한다.",16년 초과(대학원 이상),1년 초과 ~ 2년 이하,자료 (종합) / 사람 (말하기-신호) / 사물 (정밀작업),가벼운 작업,언어력,실내,-,-,"문학사연구원, 문예창작연구원, 비교문학연구원, 운문연구원, 산문연구원, 소설연구원, 평론연구원, 희곡연구원, 구비문학연구원, 아동문학연구원, 영상문학연구원, 번역문화연구원, 문학교육연구원, 연구분야에 따라 프랑스문학연구원, 독일문학연구원, 국문학연구원, 스페인문학연구원, 한문학연구원, 러시아문학연구원, 중문학연구원, 동서양고전문학연구원, 동서양문학연구원, 일본문학연구원, 영문학연구원",-,[1101]인문과학 연구원,[2121]인문과학 연구원,[M702]인문 및 사회과학 연구개발업,2012,-
